{
  "$schema": "../business.schema.json",
  "id": "4a97e55e-61a9-4608-80f6-418121df6b5f",
  "slug": "verde",
  "name": "VERDE Car Care",
  "status": "demo",
  "timezone": "Asia/Yekaterinburg",
  "locale": "ru-RU",
  "currency": "RUB",
  "profile": {
    "tagline": "Бережная мойка и уход за салоном рядом с домом",
    "description": "Семейная студия ухода за автомобилем: биоразлагаемая химия, очищенная вода, детские кресла и салон без резких запахов. Два моечных поста и отдельная зона для салона — записывайтесь на удобное время, ждать не придётся.",
    "address": "Екатеринбург, ул. Малышева, 51 (демо-адрес)",
    "mapUrl": "https://yandex.ru/maps/?text=%D0%95%D0%BA%D0%B0%D1%82%D0%B5%D1%80%D0%B8%D0%BD%D0%B1%D1%83%D1%80%D0%B3%20%D0%9C%D0%B0%D0%BB%D1%8B%D1%88%D0%B5%D0%B2%D0%B0%2051",
    "phone": "+73432001020",
    "email": "care@verde-carcare.test",
    "website": null,
    "socials": [
      { "kind": "vk", "url": "https://vk.com/verde_carcare_demo", "label": "ВКонтакте" },
      { "kind": "whatsapp", "url": "https://wa.me/73432001020", "label": "WhatsApp" }
    ]
  },
  "branding": {
    "themePreset": "white",
    "accent": "#2e6b4a",
    "logo": "assets/logo.svg",
    "icon": "assets/icon.png",
    "hero": "assets/hero.jpg",
    "heroAlt": "Чистый автомобиль в светлом боксе",
    "gallery": [
      { "src": "assets/gallery/foam.jpg", "alt": "Активная пена на кузове", "caption": "Мягкая пена без агрессивной химии" },
      { "src": "assets/gallery/interior.jpg", "alt": "Чистый салон", "caption": "Салон без резких запахов" },
      { "src": "assets/gallery/beading.jpg", "alt": "Капли воды на воске", "caption": "Защитный воск после мойки" }
    ],
    "demoArtwork": true
  },
  "seo": {
    "title": "VERDE Car Care — эко-мойка и уход за салоном, Екатеринбург",
    "description": "Запишитесь онлайн на мойку, чистку салона или защитный воск. Цена сразу, без ожидания в очереди."
  },
  "features": { "ai": true, "garage": true, "push": true },
  "policy": {
    "slotStepMin": 15,
    "minNoticeMin": 60,
    "horizonDays": 21,
    "cancelCutoffHours": 3,
    "requiresConfirmation": false,
    "maxActiveBookingsPerPhone": 4
  },
  "notifications": { "ownerPush": true, "clientPush": true, "reminderHoursBefore": 3 },
  "ai": { "dailyRequestLimit": 150, "dailyTokenBudget": 150000 },
  "hours": {
    "mon": [["08:00", "22:00"]],
    "tue": [["08:00", "22:00"]],
    "wed": [["08:00", "22:00"]],
    "thu": [["08:00", "22:00"]],
    "fri": [["08:00", "22:00"]],
    "sat": [["08:00", "22:00"]],
    "sun": [["10:00", "18:00"]]
  },
  "exceptions": [{ "date": "2027-01-01", "closed": true, "note": "Новый год" }],
  "resources": [
    { "key": "post-1", "type": "wash_bay", "name": "Пост 1" },
    { "key": "post-2", "type": "wash_bay", "name": "Пост 2" },
    { "key": "cabin", "type": "interior_station", "name": "Зона салона" }
  ],
  "services": [
    {
      "key": "eco-wash",
      "name": "Эко-мойка кузова",
      "category": "wash",
      "summary": "Ручная мойка биоразлагаемой химией, сушка микрофиброй",
      "description": "Бесконтактная пена, ручная мойка двумя вёдрами, очищенная вода на финальном ополаскивании — без разводов и известкового налёта.",
      "durationMin": 45,
      "bufferAfterMin": 15,
      "price": 1600,
      "resourceTypes": ["wash_bay"],
      "benefits": ["Очищенная вода без разводов", "Биоразлагаемая химия"],
      "recommends": ["wax-protect", "cabin-express"],
      "repeatIntervalDays": 14,
      "variants": {
        "crossover": { "price": 1900, "durationMin": 50 },
        "suv": { "price": 2200, "durationMin": 60 },
        "large_suv": { "price": 2600, "durationMin": 70 },
        "minivan": { "price": 2600, "durationMin": 70 }
      },
      "addons": [
        { "key": "wheels", "name": "Глубокая чистка дисков", "price": 700, "durationMin": 15 },
        { "key": "glass", "name": "Антидождь на лобовое", "price": 900, "durationMin": 10 }
      ],
      "images": [{ "src": "assets/services/eco-wash.jpg", "alt": "Пена на кузове" }]
    },
    {
      "key": "complex-wash",
      "name": "Комплекс: кузов + салон",
      "category": "complex",
      "summary": "Мойка кузова, пылесос, влажная уборка пластика и стёкол",
      "description": "Наш самый популярный визит: кузов, коврики, пылесос салона и багажника, влажная уборка пластика и стёкол изнутри.",
      "durationMin": 90,
      "bufferAfterMin": 15,
      "price": 2900,
      "resourceTypes": ["wash_bay"],
      "benefits": ["Всё за один визит", "Стёкла без разводов изнутри"],
      "recommends": ["cabin-deep", "wax-protect"],
      "repeatIntervalDays": 30,
      "variants": { "suv": { "price": 3500, "durationMin": 105 }, "large_suv": { "price": 3900, "durationMin": 120 }, "minivan": { "price": 3900, "durationMin": 120 } },
      "images": [{ "src": "assets/services/complex.jpg", "alt": "Автомобиль после комплексной мойки" }]
    },
    {
      "key": "cabin-express",
      "name": "Экспресс-уборка салона",
      "category": "interior",
      "summary": "Пылесос, коврики, пластик — за 40 минут",
      "description": "Быстрая уборка салона, пока вы пьёте кофе: пылесос, чистка ковриков, протирка пластика гипоаллергенным составом.",
      "durationMin": 40,
      "bufferAfterMin": 10,
      "price": 1400,
      "resourceTypes": ["interior_station"],
      "benefits": ["Гипоаллергенные составы"],
      "repeatIntervalDays": 30,
      "images": [{ "src": "assets/services/cabin.jpg", "alt": "Уборка салона" }]
    },
    {
      "key": "cabin-deep",
      "name": "Химчистка салона",
      "category": "interior",
      "summary": "Сиденья, потолок, ковры — с сушкой и озонированием",
      "description": "Экстракторная чистка тканевых и кожаных сидений, потолка и ковров. Сушим салон перед выдачей, в конце — озонирование без химических отдушек.",
      "durationMin": 300,
      "bufferAfterMin": 30,
      "price": 11000,
      "resourceTypes": ["interior_station"],
      "benefits": ["Без отдушек — подходит семьям с детьми", "Салон сухой к выдаче"],
      "prepNotes": ["Заберите детские кресла или добавьте их чистку в опции"],
      "recommends": ["eco-wash"],
      "repeatIntervalDays": 180,
      "variants": { "suv": { "price": 13500, "durationMin": 330 }, "large_suv": { "price": 15000, "durationMin": 360 }, "minivan": { "price": 15000, "durationMin": 360 } },
      "addons": [{ "key": "child-seat", "name": "Чистка детского кресла", "price": 1500, "durationMin": 30 }],
      "images": [{ "src": "assets/services/cabin-deep.jpg", "alt": "Чистые сиденья" }]
    },
    {
      "key": "wax-protect",
      "name": "Защитный воск",
      "category": "protection",
      "summary": "Мойка и твёрдый воск: блеск и защита до 2 месяцев",
      "description": "Мойка кузова, обезжиривание и нанесение твёрдого воска вручную. Грязь меньше налипает, автомобиль дольше остаётся чистым.",
      "durationMin": 75,
      "bufferAfterMin": 15,
      "price": 3200,
      "resourceTypes": ["wash_bay"],
      "benefits": ["Защита до 2 месяцев", "Грязь меньше налипает"],
      "recommends": ["cabin-express"],
      "repeatIntervalDays": 60,
      "variants": { "suv": { "price": 3900, "durationMin": 90 }, "large_suv": { "price": 4400, "durationMin": 105 } },
      "images": [{ "src": "assets/services/wax.jpg", "alt": "Капли на воске" }]
    },
    {
      "key": "winter-prep",
      "name": "Подготовка к зиме",
      "category": "protection",
      "summary": "Мойка, воск, антидождь, обработка уплотнителей",
      "description": "Комплекс перед сезоном реагентов: мойка с днищем, защитный воск, антидождь на все стёкла, силикон на уплотнители дверей.",
      "durationMin": 120,
      "bufferAfterMin": 15,
      "price": 5200,
      "resourceTypes": ["wash_bay"],
      "benefits": ["Двери не примерзают", "Меньше налипания реагентов"],
      "repeatIntervalDays": 365,
      "variants": { "suv": { "price": 6200, "durationMin": 140 }, "large_suv": { "price": 6900, "durationMin": 150 } },
      "images": [{ "src": "assets/services/winter.jpg", "alt": "Подготовленный к зиме автомобиль" }]
    }
  ],
  "owners": [{ "email": "owner@verde-carcare.test", "role": "owner" }],
  "demo": { "seedFile": "demo-seed.json" }
}
